{
  "schema_version": "1.0",
  "synthetic": true,
  "description": "Fictional five-account lab. No event or remediation result came from a live AWS account.",
  "allowed_regions": [
    "eu-west-1",
    "eu-central-1"
  ],
  "administrator_role_arns": [
    "arn:aws:iam::444444444444:role/GovernanceAdministrator",
    "arn:aws:iam::555555555555:role/GovernanceAdministrator"
  ],
  "accounts": [
    {
      "id": "111111111111",
      "name": "Management",
      "ou": "Root"
    },
    {
      "id": "222222222222",
      "name": "Security",
      "ou": "Security"
    },
    {
      "id": "333333333333",
      "name": "LogArchive",
      "ou": "LogArchive"
    },
    {
      "id": "444444444444",
      "name": "Sandbox",
      "ou": "Workloads"
    },
    {
      "id": "555555555555",
      "name": "ProductionModel",
      "ou": "Workloads"
    }
  ],
  "policy_cases": [
    {
      "id": "approved-region",
      "request": {
        "action": "ec2:RunInstances",
        "resource": "*",
        "account_type": "member",
        "service_linked_role": false,
        "context": {
          "aws:RequestedRegion": "eu-west-1",
          "aws:PrincipalArn": "arn:aws:iam::444444444444:role/WorkloadOperator"
        }
      },
      "expected": "not_denied_by_lab_scps"
    },
    {
      "id": "outside-region",
      "request": {
        "action": "ec2:RunInstances",
        "resource": "*",
        "account_type": "member",
        "service_linked_role": false,
        "context": {
          "aws:RequestedRegion": "us-west-2",
          "aws:PrincipalArn": "arn:aws:iam::444444444444:role/WorkloadOperator"
        }
      },
      "expected": "explicit_deny"
    },
    {
      "id": "secondary-approved-region",
      "request": {
        "action": "s3:CreateBucket",
        "resource": "*",
        "account_type": "member",
        "service_linked_role": false,
        "context": {
          "aws:RequestedRegion": "eu-central-1",
          "aws:PrincipalArn": "arn:aws:iam::444444444444:role/WorkloadOperator"
        }
      },
      "expected": "not_denied_by_lab_scps"
    },
    {
      "id": "global-iam",
      "request": {
        "action": "iam:ListRoles",
        "resource": "*",
        "account_type": "member",
        "service_linked_role": false,
        "context": {
          "aws:RequestedRegion": "us-east-1",
          "aws:PrincipalArn": "arn:aws:iam::444444444444:role/WorkloadOperator"
        }
      },
      "expected": "not_denied_by_lab_scps"
    },
    {
      "id": "global-route53",
      "request": {
        "action": "route53:ListHostedZones",
        "resource": "*",
        "account_type": "member",
        "service_linked_role": false,
        "context": {
          "aws:RequestedRegion": "us-east-1",
          "aws:PrincipalArn": "arn:aws:iam::444444444444:role/WorkloadOperator"
        }
      },
      "expected": "not_denied_by_lab_scps"
    },
    {
      "id": "deny-cloudtrail-stoplogging",
      "request": {
        "action": "cloudtrail:StopLogging",
        "resource": "*",
        "account_type": "member",
        "service_linked_role": false,
        "context": {
          "aws:RequestedRegion": "eu-west-1",
          "aws:PrincipalArn": "arn:aws:iam::444444444444:role/WorkloadOperator"
        }
      },
      "expected": "explicit_deny"
    },
    {
      "id": "deny-cloudtrail-deletetrail",
      "request": {
        "action": "cloudtrail:DeleteTrail",
        "resource": "*",
        "account_type": "member",
        "service_linked_role": false,
        "context": {
          "aws:RequestedRegion": "eu-west-1",
          "aws:PrincipalArn": "arn:aws:iam::444444444444:role/WorkloadOperator"
        }
      },
      "expected": "explicit_deny"
    },
    {
      "id": "deny-config-stopconfigurationrecorder",
      "request": {
        "action": "config:StopConfigurationRecorder",
        "resource": "*",
        "account_type": "member",
        "service_linked_role": false,
        "context": {
          "aws:RequestedRegion": "eu-west-1",
          "aws:PrincipalArn": "arn:aws:iam::444444444444:role/WorkloadOperator"
        }
      },
      "expected": "explicit_deny"
    },
    {
      "id": "deny-config-putconfigurationrecorder",
      "request": {
        "action": "config:PutConfigurationRecorder",
        "resource": "*",
        "account_type": "member",
        "service_linked_role": false,
        "context": {
          "aws:RequestedRegion": "eu-west-1",
          "aws:PrincipalArn": "arn:aws:iam::444444444444:role/WorkloadOperator"
        }
      },
      "expected": "explicit_deny"
    },
    {
      "id": "deny-guardduty-deletedetector",
      "request": {
        "action": "guardduty:DeleteDetector",
        "resource": "*",
        "account_type": "member",
        "service_linked_role": false,
        "context": {
          "aws:RequestedRegion": "eu-west-1",
          "aws:PrincipalArn": "arn:aws:iam::444444444444:role/WorkloadOperator"
        }
      },
      "expected": "explicit_deny"
    },
    {
      "id": "deny-guardduty-updatedetector",
      "request": {
        "action": "guardduty:UpdateDetector",
        "resource": "*",
        "account_type": "member",
        "service_linked_role": false,
        "context": {
          "aws:RequestedRegion": "eu-west-1",
          "aws:PrincipalArn": "arn:aws:iam::444444444444:role/WorkloadOperator"
        }
      },
      "expected": "explicit_deny"
    },
    {
      "id": "deny-securityhub-disablesecurityhub",
      "request": {
        "action": "securityhub:DisableSecurityHub",
        "resource": "*",
        "account_type": "member",
        "service_linked_role": false,
        "context": {
          "aws:RequestedRegion": "eu-west-1",
          "aws:PrincipalArn": "arn:aws:iam::444444444444:role/WorkloadOperator"
        }
      },
      "expected": "explicit_deny"
    },
    {
      "id": "deny-securityhub-batchdisablestandards",
      "request": {
        "action": "securityhub:BatchDisableStandards",
        "resource": "*",
        "account_type": "member",
        "service_linked_role": false,
        "context": {
          "aws:RequestedRegion": "eu-west-1",
          "aws:PrincipalArn": "arn:aws:iam::444444444444:role/WorkloadOperator"
        }
      },
      "expected": "explicit_deny"
    },
    {
      "id": "deny-kms-schedulekeydeletion",
      "request": {
        "action": "kms:ScheduleKeyDeletion",
        "resource": "*",
        "account_type": "member",
        "service_linked_role": false,
        "context": {
          "aws:RequestedRegion": "eu-west-1",
          "aws:PrincipalArn": "arn:aws:iam::444444444444:role/WorkloadOperator"
        }
      },
      "expected": "explicit_deny"
    },
    {
      "id": "deny-kms-putkeypolicy",
      "request": {
        "action": "kms:PutKeyPolicy",
        "resource": "*",
        "account_type": "member",
        "service_linked_role": false,
        "context": {
          "aws:RequestedRegion": "eu-west-1",
          "aws:PrincipalArn": "arn:aws:iam::444444444444:role/WorkloadOperator"
        }
      },
      "expected": "explicit_deny"
    },
    {
      "id": "approved-administrator-change",
      "request": {
        "action": "cloudtrail:UpdateTrail",
        "resource": "*",
        "account_type": "member",
        "service_linked_role": false,
        "context": {
          "aws:RequestedRegion": "eu-west-1",
          "aws:PrincipalArn": "arn:aws:iam::444444444444:role/GovernanceAdministrator"
        }
      },
      "expected": "not_denied_by_lab_scps"
    },
    {
      "id": "administrator-still-region-restricted",
      "request": {
        "action": "cloudtrail:UpdateTrail",
        "resource": "*",
        "account_type": "member",
        "service_linked_role": false,
        "context": {
          "aws:RequestedRegion": "us-west-2",
          "aws:PrincipalArn": "arn:aws:iam::444444444444:role/GovernanceAdministrator"
        }
      },
      "expected": "explicit_deny"
    },
    {
      "id": "governance-trust-protected",
      "request": {
        "action": "iam:UpdateAssumeRolePolicy",
        "resource": "arn:aws:iam::444444444444:role/GovernanceAdministrator",
        "account_type": "member",
        "service_linked_role": false,
        "context": {
          "aws:RequestedRegion": "eu-west-1",
          "aws:PrincipalArn": "arn:aws:iam::444444444444:role/WorkloadOperator"
        }
      },
      "expected": "explicit_deny"
    },
    {
      "id": "governance-role-creation-protected",
      "request": {
        "action": "iam:CreateRole",
        "resource": "arn:aws:iam::444444444444:role/GovernanceAdministrator",
        "account_type": "member",
        "service_linked_role": false,
        "context": {
          "aws:RequestedRegion": "eu-west-1",
          "aws:PrincipalArn": "arn:aws:iam::444444444444:role/WorkloadOperator"
        }
      },
      "expected": "explicit_deny"
    },
    {
      "id": "workload-role-not-governance-role",
      "request": {
        "action": "iam:UpdateAssumeRolePolicy",
        "resource": "arn:aws:iam::444444444444:role/WorkloadOperator",
        "account_type": "member",
        "service_linked_role": false,
        "context": {
          "aws:RequestedRegion": "eu-west-1",
          "aws:PrincipalArn": "arn:aws:iam::444444444444:role/WorkloadOperator"
        }
      },
      "expected": "not_denied_by_lab_scps"
    },
    {
      "id": "cannot-leave-organization",
      "request": {
        "action": "organizations:LeaveOrganization",
        "resource": "*",
        "account_type": "member",
        "service_linked_role": false,
        "context": {
          "aws:RequestedRegion": "eu-west-1",
          "aws:PrincipalArn": "arn:aws:iam::444444444444:role/GovernanceAdministrator"
        }
      },
      "expected": "explicit_deny"
    },
    {
      "id": "root-access-key-blocked",
      "request": {
        "action": "iam:CreateAccessKey",
        "resource": "*",